{
  "schema_version": "stage0.rev2",
  "contract_id": "trace_visibility_export_retention_stage0_rev2",
  "blueprint_source": "Docs/stage0_blueprint_rev2.md",
  "links": {
    "trace_completeness": "fixtures/stage0/rev2/eval/trace_completeness.json",
    "trace_export_gate_matrix": "fixtures/stage0/rev2/eval/trace_export_gate_matrix.json",
    "eval_results": "fixtures/stage0/rev2/eval/starter_eval_results.json",
    "qa_results": "fixtures/stage0/rev2/eval/qa_results.json"
  },
  "required_projection_fields": [
    "user_trace_projection",
    "admin_trace_projection",
    "export_retention_projection",
    "source_trace_ref",
    "source_eval_result_ref",
    "source_gate_case_ref"
  ],
  "projection_policies": {
    "user_projection_excludes_internal_payload": true,
    "admin_projection_requires_rbac": true,
    "admin_projection_links_trace_eval_qa_safety_export": true,
    "blocked_export_retains_trace_provenance": true,
    "blocked_export_retains_qa_report_when_available": true,
    "download_requires_final_export_allowed": true
  },
  "trace_projection_cases": [
    {
      "case_id": "trace_visibility_case_ecommerce_growth_golden",
      "fixture_id": "fx_ecommerce_growth_golden",
      "workflow": "ecommerce_growth_pack",
      "source_trace_ref": {"trace_id": "trace_fx_ecommerce_growth_golden_aspect", "task_id": "task_fx_ecommerce_growth_golden", "request_id": "req_fx_ecommerce_growth_golden"},
      "source_eval_result_ref": {"result_id": "eval_result_stage0_rev2_starter_contract", "fixture_id": "fx_ecommerce_growth_golden", "status": "blocked", "final_export_allowed": false, "denial_reasons": ["qa_coverage_incomplete"]},
      "source_gate_case_ref": {"case_id": "gate_case_ecommerce_growth_golden", "package_id": "package_fx_ecommerce_growth_golden", "export_id": "export_fx_ecommerce_growth_golden", "admin_override_required_for_export": true, "override_requires_audit": true},
      "user_trace_projection": {"visible_fields": ["trace_id", "task_id", "workflow", "task_status", "user_message", "final_export_allowed", "denial_reasons", "export_id"], "hidden_fields": ["provider_payload", "internal_prompt", "raw_safety_payload", "safety_rule_rationale", "admin_audit_notes", "quota_transaction_internal_metadata", "agent_step_payload"], "failure_mapping_required": true, "includes_denial_reasons": true, "download_enabled": false},
      "admin_trace_projection": {"visible_tables": ["agent_traces", "eval_results", "qa_results", "safety_decisions", "exports", "audit_logs"], "rbac_scope": "admin_reviewer", "payload_redaction_required": true, "links_trace_export_eval_qa_safety": true, "safety_decision_steps": ["brief", "provider_request", "provider_response", "qa", "export"]},
      "export_retention_projection": {"package_id": "package_fx_ecommerce_growth_golden", "export_id": "export_fx_ecommerce_growth_golden", "retained_files": ["manifest.json", "qa_report.json", "metadata.json", "trace_provenance.json", "safety_disclaimer.md"], "retained_when_blocked": ["qa_report.json", "trace_provenance.json", "safety_disclaimer.md"], "download_enabled": false, "final_export_allowed": false, "retention_reasons": ["qa_coverage_incomplete"]}
    },
    {
      "case_id": "trace_visibility_case_business_visual_doc_golden",
      "fixture_id": "fx_business_visual_doc_golden",
      "workflow": "business_visual_doc_pack",
      "source_trace_ref": {"trace_id": "trace_fx_business_visual_doc_golden_readability", "task_id": "task_fx_business_visual_doc_golden", "request_id": "req_fx_business_visual_doc_golden"},
      "source_eval_result_ref": {"result_id": "eval_result_stage0_rev2_starter_contract", "fixture_id": "fx_business_visual_doc_golden", "status": "blocked", "final_export_allowed": false, "denial_reasons": ["qa_coverage_incomplete"]},
      "source_gate_case_ref": {"case_id": "gate_case_business_visual_doc_golden", "package_id": "package_fx_business_visual_doc_golden", "export_id": "export_fx_business_visual_doc_golden", "admin_override_required_for_export": true, "override_requires_audit": true},
      "user_trace_projection": {"visible_fields": ["trace_id", "task_id", "workflow", "task_status", "user_message", "final_export_allowed", "denial_reasons", "export_id"], "hidden_fields": ["provider_payload", "internal_prompt", "raw_safety_payload", "safety_rule_rationale", "admin_audit_notes", "quota_transaction_internal_metadata", "agent_step_payload"], "failure_mapping_required": true, "includes_denial_reasons": true, "download_enabled": false},
      "admin_trace_projection": {"visible_tables": ["agent_traces", "eval_results", "qa_results", "safety_decisions", "exports", "audit_logs"], "rbac_scope": "admin_reviewer", "payload_redaction_required": true, "links_trace_export_eval_qa_safety": true, "safety_decision_steps": ["brief", "provider_request", "provider_response", "qa", "export"]},
      "export_retention_projection": {"package_id": "package_fx_business_visual_doc_golden", "export_id": "export_fx_business_visual_doc_golden", "retained_files": ["manifest.json", "qa_report.json", "metadata.json", "trace_provenance.json", "safety_disclaimer.md"], "retained_when_blocked": ["qa_report.json", "trace_provenance.json", "safety_disclaimer.md"], "download_enabled": false, "final_export_allowed": false, "retention_reasons": ["qa_coverage_incomplete"]}
    },
    {
      "case_id": "trace_visibility_case_local_merchant_campaign_golden",
      "fixture_id": "fx_local_merchant_campaign_golden",
      "workflow": "local_merchant_campaign_pack",
      "source_trace_ref": {"trace_id": "trace_fx_local_merchant_campaign_golden_dimensions", "task_id": "task_fx_local_merchant_campaign_golden", "request_id": "req_fx_local_merchant_campaign_golden"},
      "source_eval_result_ref": {"result_id": "eval_result_stage0_rev2_starter_contract", "fixture_id": "fx_local_merchant_campaign_golden", "status": "blocked", "final_export_allowed": false, "denial_reasons": ["blocking_qa", "qa_coverage_incomplete"]},
      "source_gate_case_ref": {"case_id": "gate_case_local_merchant_campaign_golden", "package_id": "package_fx_local_merchant_campaign_golden", "export_id": "export_fx_local_merchant_campaign_golden", "admin_override_required_for_export": true, "override_requires_audit": true},
      "user_trace_projection": {"visible_fields": ["trace_id", "task_id", "workflow", "task_status", "user_message", "final_export_allowed", "denial_reasons", "export_id"], "hidden_fields": ["provider_payload", "internal_prompt", "raw_safety_payload", "safety_rule_rationale", "admin_audit_notes", "quota_transaction_internal_metadata", "agent_step_payload"], "failure_mapping_required": true, "includes_denial_reasons": true, "download_enabled": false},
      "admin_trace_projection": {"visible_tables": ["agent_traces", "eval_results", "qa_results", "safety_decisions", "exports", "audit_logs"], "rbac_scope": "admin_reviewer", "payload_redaction_required": true, "links_trace_export_eval_qa_safety": true, "safety_decision_steps": ["brief", "provider_request", "provider_response", "qa", "export"]},
      "export_retention_projection": {"package_id": "package_fx_local_merchant_campaign_golden", "export_id": "export_fx_local_merchant_campaign_golden", "retained_files": ["manifest.json", "qa_report.json", "metadata.json", "trace_provenance.json", "safety_disclaimer.md"], "retained_when_blocked": ["qa_report.json", "trace_provenance.json", "safety_disclaimer.md"], "download_enabled": false, "final_export_allowed": false, "retention_reasons": ["blocking_qa", "qa_coverage_incomplete"]}
    },
    {
      "case_id": "trace_visibility_case_character_ip_concept_golden",
      "fixture_id": "fx_character_ip_concept_golden",
      "workflow": "character_ip_concept_pack",
      "source_trace_ref": {"trace_id": "trace_fx_character_ip_concept_golden_blank", "task_id": "task_fx_character_ip_concept_golden", "request_id": "req_fx_character_ip_concept_golden"},
      "source_eval_result_ref": {"result_id": "eval_result_stage0_rev2_starter_contract", "fixture_id": "fx_character_ip_concept_golden", "status": "blocked", "final_export_allowed": false, "denial_reasons": ["blocking_qa", "safety_admin_review_required", "qa_coverage_incomplete"]},
      "source_gate_case_ref": {"case_id": "gate_case_character_ip_concept_golden", "package_id": "package_fx_character_ip_concept_golden", "export_id": "export_fx_character_ip_concept_golden", "admin_override_required_for_export": true, "override_requires_audit": true},
      "user_trace_projection": {"visible_fields": ["trace_id", "task_id", "workflow", "task_status", "user_message", "final_export_allowed", "denial_reasons", "export_id"], "hidden_fields": ["provider_payload", "internal_prompt", "raw_safety_payload", "safety_rule_rationale", "admin_audit_notes", "quota_transaction_internal_metadata", "agent_step_payload"], "failure_mapping_required": true, "includes_denial_reasons": true, "download_enabled": false},
      "admin_trace_projection": {"visible_tables": ["agent_traces", "eval_results", "qa_results", "safety_decisions", "exports", "audit_logs"], "rbac_scope": "admin_reviewer", "payload_redaction_required": true, "links_trace_export_eval_qa_safety": true, "safety_decision_steps": ["brief", "provider_request", "provider_response", "qa", "export"]},
      "export_retention_projection": {"package_id": "package_fx_character_ip_concept_golden", "export_id": "export_fx_character_ip_concept_golden", "retained_files": ["manifest.json", "qa_report.json", "metadata.json", "trace_provenance.json", "safety_disclaimer.md"], "retained_when_blocked": ["qa_report.json", "trace_provenance.json", "safety_disclaimer.md"], "download_enabled": false, "final_export_allowed": false, "retention_reasons": ["blocking_qa", "safety_admin_review_required", "qa_coverage_incomplete"]}
    },
    {
      "case_id": "trace_visibility_case_ambiguous_brief_missing_product",
      "fixture_id": "fx_ambiguous_brief_missing_product",
      "workflow": "ecommerce_growth_pack",